{
   "testcaseNumber": 27,
   "testcaseLeader": "Leuven",
   "cultivationType": "Milk",
   "datsInformation": [],
   "yearlyAssessmentInformation": [
      {
         "cultivationYear": 2023,
         "parcelComparison": [],
         "marketInformation": {
            "waterPrice": null,
            "fuelPrice": null,
            "electricityPrice": null,
            "averageSalary": null,
            "averageProfessionalSalary": null
         }
      },
      {
         "cultivationYear": 2024,
         "parcelComparison": [
            {
               "parcelAssessmentWithDATS": {
                  "farmInformation": {
                     "farmNumber": 1,
                     "biogeographicalRegion": "Continental",
                     "totalFarmSize": 75.6
                  },
                  "parcelInformation": {
                     "parcelName": "Ellerbrock",
                     "parcelDimension": 75.6,
                     "startMonth": null,
                     "endMonth": null,
                     "productType": "Dairy cattle",
                     "numberOfEmployees": null,
                     "numberOfFulltimeEmployees": null,
                     "numberOfSeasonalEmployees": null,
                     "soilFractionSand": null,
                     "soilFractionClay": null,
                     "soilFractionSilt": null,
                     "bulkDensity": null,
                     "soilOrganicCarbon": null,
                     "numberOfAnimals": 247,
                     "numberOfPlants": null,
                     "livestockUnits": 3.27,
                     "numberOfBeehives": null,
                     "aquacultureArea": null
                  },
                  "datsUsed": [],
                  "waterUsageInformation": {
                     "totalWaterUsage": 4250,
                     "waterUsageForIrrigation": null,
                     "waterUsageForFertigation": null,
                     "waterUsageForPestDilution": null,
                     "waterUsageForCleaning": null,
                     "waterUsageForDrinking": null
                  },
                  "fuelUsageInformation": {
                     "totalFuelUsage": 17200,
                     "fuelUsageForFertilisation": null,
                     "fuelUsageForPesticides": null,
                     "fuelUsageForIrrigation": null,
                     "fuelUsageForSowing": null,
                     "fuelUsageForPruning": null,
                     "fuelUsageForTemperatureHumidityControl": null,
                     "fuelUsageForBeehivesVisits": null,
                     "fuelUsageForTransportingOysters": null,
                     "fuelUsageForMilking": null,
                     "fuelUsageForFeeding": null
                  },
                  "electricityUsageInformation": {
                     "totalElectricityUsage": 41000,
                     "electricityUsageForTemperatureHumidityControl": null,
                     "electricityUsageForIrrigation": null,
                     "electricityUsageForMilking": null,
                     "electricityUsageForHeatDetection": null,
                     "electricityUsageForCalvingDetection": null,
                     "electricityUsageForFeeding": null
                  },
                  "fuelForTemperatureControlInformation": [],
                  "pesticidesUsageInformation": [],
                  "fertilizersUsageInformation": [],
                  "feedUsageInformation": [
                     {
                        "productName": "Concentrate",
                        "quantity": 2000,
                        "productPrice": 21.2
                     }
                  ],
                  "drugsUsageInformation": [
                     {
                        "productName": "Tetracycline",
                        "quantity": 200,
                        "productPrice": 5.6
                     }
                  ],
                  "labourInformation": {
                     "labourForIrrigation": null,
                     "labourForPesticides": null,
                     "labourForFertilisation": null,
                     "labourForSowingOrPlanting": null,
                     "labourForPruning": null,
                     "labourForFieldVisits": null,
                     "labourForGreenhouseManagement": null,
                     "labourForQuantityTracking": null,
                     "labourForGrainQualityAssessment": null,
                     "labourForControllingPricesAndQuantities": null,
                     "labourForOrganisingLogistics": null,
                     "labourForCleaning": null,
                     "labourForStableVisits": null,
                     "labourForHeatDetection": null,
                     "labourForCalvingDetection": null,
                     "labourForPigstyManagement": null,
                     "labourForMilking": null,
                     "labourForMilkQualityAssessment": null,
                     "labourForFeeding": null,
                     "labourForBeehiveVisits": null,
                     "labourForOysterSampling": null,
                     "labourForOysterTransportation": null,
                     "labourForHarvesting": null,
                     "labourForStorage": null,
                     "labourForAdministration": null
                  },
                  "economicInformation": {
                     "numberOfFulfilledOrders": null,
                     "numberOfOrdersReceived": null,
                     "numberOfWrongOrders": null,
                     "additionalRevenues": null,
                     "percentageProteinInDryMatter": null,
                     "humidity": null,
                     "testWeight": null
                  },
                  "outputInformation": {
                     "cropProduction": null,
                     "milkProduction": 1192853,
                     "meatProduction": null,
                     "oysterProduction": null,
                     "honeyProduction": null,
                     "silosProduction": null,
                     "productMarketPrice": null,
                     "cropMarketPrice": null,
                     "meatMarketPrice": null,
                     "milkMarketPrice": 0.45,
                     "oysterMarketPrice": null,
                     "honeyMarketPrice": null
                  },
                  "additionalAnimalInformation": {
                     "numberOfDeathAnimals": 6,
                     "calvesDiedInFirst24Hours": 1,
                     "totalNumberOfCalvesBorn": 124,
                     "numberOfDaysWithPastureAccess": 0,
                     "outdoorLoafingArea": 0,
                     "herdSize": null,
                     "numberOfCowsWithHighSCCMilk": 0
                  },
                  "additionalLabourInformation": {
                     "numberOfNewInjuryCases": null,
                     "totalNumberOfLostWorkingHours": null,
                     "totalNumberOfWorkingHours": null,
                     "numberOfWorkingWeeks": null,
                     "numberOfNewLocalEmployeesHired": null,
                     "numberOfNewEmployeesHired": null
                  },
                  "additionalFieldsInformation": []
               },
               "parcelAssessmentWithoutDATS": {
                  "farmInformation": {
                     "farmNumber": 2,
                     "biogeographicalRegion": "Continental",
                     "totalFarmSize": 113
                  },
                  "parcelInformation": {
                     "parcelName": "Odenfelderhof",
                     "parcelDimension": 113,
                     "startMonth": null,
                     "endMonth": null,
                     "productType": "Dairy cattle",
                     "numberOfEmployees": 0,
                     "numberOfFulltimeEmployees": 0,
                     "numberOfSeasonalEmployees": 0,
                     "soilFractionSand": null,
                     "soilFractionClay": null,
                     "soilFractionSilt": null,
                     "bulkDensity": null,
                     "soilOrganicCarbon": null,
                     "numberOfAnimals": 234,
                     "numberOfPlants": null,
                     "livestockUnits": 2,
                     "numberOfBeehives": null,
                     "aquacultureArea": null
                  },
                  "datsUsed": [],
                  "waterUsageInformation": {
                     "totalWaterUsage": 5521,
                     "waterUsageForIrrigation": null,
                     "waterUsageForFertigation": null,
                     "waterUsageForPestDilution": null,
                     "waterUsageForCleaning": null,
                     "waterUsageForDrinking": null
                  },
                  "fuelUsageInformation": {
                     "totalFuelUsage": 14600,
                     "fuelUsageForFertilisation": null,
                     "fuelUsageForPesticides": null,
                     "fuelUsageForIrrigation": null,
                     "fuelUsageForSowing": null,
                     "fuelUsageForPruning": null,
                     "fuelUsageForTemperatureHumidityControl": null,
                     "fuelUsageForBeehivesVisits": null,
                     "fuelUsageForTransportingOysters": null,
                     "fuelUsageForMilking": null,
                     "fuelUsageForFeeding": null
                  },
                  "electricityUsageInformation": {
                     "totalElectricityUsage": 26079,
                     "electricityUsageForTemperatureHumidityControl": null,
                     "electricityUsageForIrrigation": null,
                     "electricityUsageForMilking": null,
                     "electricityUsageForHeatDetection": null,
                     "electricityUsageForCalvingDetection": null,
                     "electricityUsageForFeeding": null